{
  "name": "code-agent",
  "category": "tool_use",
  "topology": "single-agent-loop",
  "context": "Agents that write and execute code to accomplish tasks, using the execution results as observations that ground subsequent reasoning. The agent produces code (not free-form text) as its primary action, executes it in a sandbox, and reads the output as an observation. Code is the agent's main tool — it can perform calculations, interact with filesystems, call APIs, and orchestrate sub-processes. This pattern is the foundation of autonomous coding agents like SWE-Agent, Devin, and Claude Code's internal tool-use model.",
  "benefits": [
    "Code provides precise, executable instructions — no parsing ambiguity",
    "Execution results are deterministic ground-truth observations",
    "Agents can build on prior code outputs without prompt re-entry",
    "Sandboxed execution provides safety boundaries for dangerous operations"
  ],
  "tradeoffs": [
    "Requires a reliable code execution environment",
    "Code generation quality depends heavily on the model's coding capability",
    "Debugging failed code requires the agent to interpret error messages",
    "Execution environment state can drift across runs"
  ],
  "quality_attributes": {
    "reliability": 8,
    "cost_efficiency": 6,
    "latency": 6,
    "output_quality": 9,
    "observability": 7,
    "safety": 6,
    "simplicity": 6
  },
  "suitable_domains": [
    "code-generation",
    "data-analysis",
    "autonomous-task-execution",
    "research-reports",
    "database-operations",
    "devops",
    "multimodal",
    "software-testing",
    "gui-computer-use"
  ],
  "unsuitable_domains": [
    "customer-support",
    "conversational-assistants"
  ],
  "use_cases": [
    "Autonomous bug fixing with test-driven feedback",
    "Data analysis scripts over large datasets",
    "Repository-level code search and modification",
    "Automated report generation with live data computation"
  ],
  "avoid_when": [
    "No code execution environment is available",
    "Tasks are purely conversational without computational elements",
    "Latency-sensitive interactive applications",
    "Environments where code execution is prohibited"
  ],
  "component_types": [
    "Code Generator",
    "Sandbox Executor",
    "Output Parser",
    "State Manager",
    "Error Diagnoser"
  ],
  "technology_stack": [
    "SWE-Agent",
    "Claude Code runtime",
    "E2B sandbox",
    "Pyodide",
    "Bash tool"
  ],
  "anti_patterns": [
    "Trusting code output without validating it",
    "No sandboxing — executing code in the production environment",
    "Accumulating execution state without resetting between tasks"
  ],
  "migration_from": [
    "react",
    "structured-output"
  ],
  "migration_to": [
    "procedural-memory",
    "subagent-isolation"
  ],
  "design_principles": [
    "Always sandbox code execution — never in the production environment",
    "Treat execution errors as observations, not failures",
    "Code should be self-contained and stateless where possible"
  ],
  "best_practices": [
    "Use a fresh sandbox for each code execution to avoid state pollution",
    "Set resource limits (CPU, memory, time) on code execution",
    "Parse and validate code output programmatically before proceeding"
  ],
  "references": [
    "Yang et al., SWE-Agent: Agentic LLM for Software Engineering, 2024 — https://arxiv.org/abs/2405.15793",
    "Anthropic, Claude Computer Use, 2024 — https://www.anthropic.com/news/claude-computer-use"
  ]
}
